{"metrics":[{"budgetClass":"hard_ceiling","description":"Assertions that fired during the run. Correctness, not performance.","labels":["label_00","label_01","label_02","label_03","label_04","label_05","label_06","label_07","label_08","label_09","label_10","label_11","label_12","label_13","label_14","label_15","label_16","label_17","label_18","label_19","label_20","label_21","label_22","label_23","label_24","label_25","label_26","label_27","label_28","label_29","label_30","label_31","label_32","label_33","label_34","label_35","label_36","label_37","label_38","label_39","label_40","label_41","label_42","label_43","label_44","label_45","label_46","label_47","label_48","label_49","label_50","label_51","label_52","label_53","label_54","label_55","label_56","label_57","label_58","label_59","label_60","label_61","label_62","label_63"],"metricGeneration":1,"metricId":"harness.assertion_failure.count","owner":"evidence_harness","polarity":"lower_is_better","queryId":"harness.assertion_failure.count.v1","rescaling":{"direction":"bound_to_observation","rounding":"reject_inexact"},"sampling":{"blockLength":1,"kind":"per_run"},"scaleExponent":0,"scope":"run","stability":"stable","statistic":"count","unit":"count"}],"recordKind":"metric_registry","registryGeneration":1,"schemaVersion":1}