{"metrics":[{"budgetClass":"hard_ceiling","description":"Assertions that fired during the run. Correctness, not performance.","metricGeneration":1,"metricId":"harness.assertion_failure.count","owner":"evidence_harness","polarity":"lower_is_better","queryId":"harness.assertion_failure.count.v1","rescaling":{"direction":"bound_to_observation","rounding":"reject_inexact"},"sampling":{"blockLength":1,"kind":"per_run"},"scaleExponent":0,"scope":"run","stability":"stable","statistic":"count","unit":"count"},{"budgetClass":"hard_ceiling","description":"Required raw attachments the receipt named but could not be retrieved.","metricGeneration":1,"metricId":"harness.attachment_missing.count","owner":"evidence_harness","polarity":"lower_is_better","queryId":"harness.attachment_missing.count.v1","rescaling":{"direction":"bound_to_observation","rounding":"reject_inexact"},"sampling":{"blockLength":1,"kind":"per_run"},"scaleExponent":0,"scope":"run","stability":"stable","statistic":"count","unit":"count"},{"budgetClass":"hard_ceiling","description":"Protocol, scenario, and World invariants the workload observed to break.","metricGeneration":1,"metricId":"harness.invariant_violation.count","owner":"evidence_harness","polarity":"lower_is_better","queryId":"harness.invariant_violation.count.v1","rescaling":{"direction":"bound_to_observation","rounding":"reject_inexact"},"sampling":{"blockLength":1,"kind":"per_run"},"scaleExponent":0,"scope":"run","stability":"stable","statistic":"count","unit":"count"},{"budgetClass":"contract_constant","description":"Samples the run actually produced. A run that observed nothing is incomplete.","metricGeneration":1,"metricId":"harness.observation.sample_count","owner":"evidence_harness","polarity":"higher_is_better","queryId":"harness.observation.sample_count.v1","rescaling":{"direction":"bound_to_observation","rounding":"reject_inexact"},"sampling":{"blockLength":1,"kind":"per_run"},"scaleExponent":0,"scope":"run","stability":"stable","statistic":"count","unit":"count"},{"budgetClass":"hard_ceiling","description":"Blocking workload failures. Never an infrastructure error and never discardable.","metricGeneration":1,"metricId":"harness.workload_failure.count","owner":"evidence_harness","polarity":"lower_is_better","queryId":"harness.workload_failure.count.v1","rescaling":{"direction":"bound_to_observation","rounding":"reject_inexact"},"sampling":{"blockLength":1,"kind":"per_run"},"scaleExponent":0,"scope":"run","stability":"stable","statistic":"count","unit":"count"},{"budgetClass":"hard_ceiling","description":"Peak resident set of the whole process, in bytes.","metricGeneration":1,"metricId":"process.resident_memory.maximum","owner":"rawframe.host.dedicated_server","polarity":"lower_is_better","queryId":"process.resident_memory.maximum.v1","rescaling":{"direction":"bound_to_observation","rounding":"reject_inexact"},"sampling":{"blockLength":1,"kind":"per_run"},"scaleExponent":0,"scope":"process","stability":"stable","statistic":"maximum","unit":"byte"},{"budgetClass":"hard_ceiling","description":"Largest number of catch-up ticks executed after one authoritative tick.","metricGeneration":1,"metricId":"tick.catch_up.maximum","owner":"rawframe.world","polarity":"lower_is_better","queryId":"tick.catch_up.maximum.v1","rescaling":{"direction":"bound_to_observation","rounding":"reject_inexact"},"sampling":{"blockLength":3600,"kind":"per_tick"},"scaleExponent":0,"scope":"world_tick","stability":"stable","statistic":"maximum","unit":"count"},{"budgetClass":"performance_objective","description":"Median authoritative tick duration.","metricGeneration":1,"metricId":"tick.duration.p50","owner":"rawframe.world","polarity":"lower_is_better","queryId":"tick.duration.p50.v1","rescaling":{"direction":"bound_to_observation","rounding":"reject_inexact"},"sampling":{"blockLength":3600,"kind":"per_tick"},"scaleExponent":0,"scope":"world_tick","stability":"stable","statistic":"p50","unit":"nanosecond"},{"budgetClass":"performance_objective","description":"95th percentile authoritative tick duration.","metricGeneration":1,"metricId":"tick.duration.p95","owner":"rawframe.world","polarity":"lower_is_better","queryId":"tick.duration.p95.v1","rescaling":{"direction":"bound_to_observation","rounding":"reject_inexact"},"sampling":{"blockLength":3600,"kind":"per_tick"},"scaleExponent":0,"scope":"world_tick","stability":"stable","statistic":"p95","unit":"nanosecond"},{"budgetClass":"performance_objective","description":"99th percentile authoritative tick duration.","metricGeneration":1,"metricId":"tick.duration.p99","owner":"rawframe.world","polarity":"lower_is_better","queryId":"tick.duration.p99.v1","rescaling":{"direction":"bound_to_observation","rounding":"reject_inexact"},"sampling":{"blockLength":3600,"kind":"per_tick"},"scaleExponent":0,"scope":"world_tick","stability":"stable","statistic":"p99","unit":"nanosecond"}],"recordKind":"metric_registry","registryGeneration":1,"schemaVersion":1}