{"metrics":[{"budgetClass":"hard_ceiling","metricGeneration":1,"metricId":"tick.duration.p99","owner":"rawframe.world","polarity":"lower_is_better","queryId":"tick.duration.p99.v1","rescaling":{"direction":"bound_to_observation","rounding":"toward_negative_infinity"},"sampling":{"blockLength":3600,"kind":"per_tick"},"scaleExponent":0,"scope":"world_tick","stability":"stable","statistic":"p99","unit":"nanosecond"}],"recordKind":"metric_registry","registryGeneration":1,"schemaVersion":1}