{"metrics":[{"budgetClass":"hard_ceiling","description":"Assertions that fired during the run. Correctness, not performance.","metricGeneration":1,"metricId":"harness.assertion_failure.count","owner":"evidence_harness","polarity":"lower_is_better","queryId":"harness.assertion_failure.count.v1","rescaling":{"direction":"bound_to_observation","rounding":"reject_inexact"},"sampling":{"blockLength":1,"kind":"per_run"},"scaleExponent":0,"scope":"run","stability":"stable","statistic":"count","unit":"count"},{"budgetClass":"hard_ceiling","description":"Assertions that fired during the run. Correctness, not performance.","metricGeneration":2,"metricId":"harness.assertion_failure.count","owner":"evidence_harness","polarity":"lower_is_better","queryId":"harness.assertion_failure.count.v1","rescaling":{"direction":"bound_to_observation","rounding":"reject_inexact"},"sampling":{"blockLength":1,"kind":"per_run"},"scaleExponent":0,"scope":"run","stability":"stable","statistic":"count","unit":"nanosecond"}],"recordKind":"metric_registry","registryGeneration":1,"schemaVersion":1}